{
  "schemaName": "EventEnvelope",
  "schemaVersion": "1.0.0",
  "kind": "memory",
  "topic": "memory.consolidate.v1",
  "message_id": "msg-mem-consolidate-001",
  "emitted_utc": "2026-02-06T14:22:00Z",
  "trace_id": "trace-mem-consolidate-001",
  "payload": {
    "schemaName": "MemoryConsolidate",
    "schemaVersion": "1.0.0",
    "issuedUtc": "2026-02-06T14:22:00Z",
    "scope": "task:AAS-123",
    "namespace": "observations",
    "policyId": "mem-consolidate-default",
    "dryRun": true
  },
  "source": {
    "component": "memory-provider",
    "instanceId": "dev-01"
  }
}
