{
  "schemaName": "EventEnvelope",
  "schemaVersion": "1.0.0",
  "kind": "ops",
  "topic": "ops.resource.policy.v1",
  "message_id": "msg-resource-policy-001",
  "emitted_utc": "2026-02-06T15:31:00Z",
  "trace_id": "trace-resource-001",
  "payload": {
    "schemaName": "ResourceRoutingPolicy",
    "schemaVersion": "1.0.0",
    "issuedUtc": "2026-02-06T15:31:00Z",
    "policyId": "resource-default",
    "enabled": true,
    "defaults": { "idleGpuUtilPercent": 30, "busyCpuPercent": 75, "overheadTolerance": 1.5 }
  },
  "source": { "component": "resource-router", "instanceId": "dev-01" }
}
