{
  "schemaName": "EventEnvelope",
  "schemaVersion": "1.0.0",
  "kind": "memory",
  "topic": "memory.search.result.v1",
  "message_id": "msg-mem-search-result-001",
  "emitted_utc": "2026-02-06T13:10:01Z",
  "trace_id": "trace-mem-search-001",
  "correlation_id": "msg-mem-search-001",
  "payload": {
    "schemaName": "MemorySearchResult",
    "schemaVersion": "1.0.0",
    "generatedUtc": "2026-02-06T13:10:01Z",
    "items": []
  },
  "source": {
    "component": "memory-provider",
    "instanceId": "dev-01"
  }
}
