{
  "schemaName": "EventEnvelope",
  "schemaVersion": "1.0.0",
  "kind": "swarm",
  "topic": "swarm.membership.heartbeat.v1",
  "message_id": "msg-swarm-hb-001",
  "emitted_utc": "2026-02-06T12:00:00Z",
  "trace_id": "trace-swarm-hb-001",
  "payload": {
    "schemaName": "SwarmMembershipHeartbeat",
    "schemaVersion": "1.0.0",
    "emittedUtc": "2026-02-06T12:00:00Z",
    "ttlSec": 10,
    "nodeId": "node-a",
    "instanceId": "dev-01",
    "health": { "status": "ok" },
    "capabilities": ["screen.capture@1.0.0"]
  },
  "source": {
    "component": "swarm-heartbeat",
    "instanceId": "dev-01"
  }
}
