{
  "schemaName": "EventEnvelope",
  "schemaVersion": "1.0.0",
  "kind": "swarm",
  "topic": "swarm.provider.assignment.v1",
  "message_id": "msg-swarm-asg-001",
  "emitted_utc": "2026-02-06T12:00:05Z",
  "trace_id": "trace-swarm-asg-001",
  "payload": {
    "schemaName": "SwarmProviderAssignment",
    "schemaVersion": "1.0.0",
    "computedUtc": "2026-02-06T12:00:05Z",
    "epoch": "42",
    "capabilityId": "screen.capture@1.0.0",
    "primary": {
      "hiveId": "local",
      "instanceId": "dev-01",
      "componentId": "plugins.game_automation",
      "nodeId": "node-a"
    },
    "secondaries": [
      {
        "hiveId": "local",
        "instanceId": "dev-02",
        "componentId": "plugins.game_automation",
        "nodeId": "node-b"
      }
    ],
    "coordinator": { "nodeId": "node-a", "instanceId": "dev-01" },
    "reason": "deterministic sort"
  },
  "source": {
    "component": "swarm-coordinator",
    "instanceId": "dev-01"
  }
}
