{
  "schemaName": "EventEnvelope",
  "schemaVersion": "1.0.0",
  "kind": "research",
  "topic": "research.discovery.v1",
  "message_id": "msg-research-discovery-001",
  "emitted_utc": "2026-02-06T15:00:00Z",
  "trace_id": "trace-research-001",
  "payload": {
    "schemaName": "ResearchDiscoveryRequest",
    "schemaVersion": "1.0.0",
    "issuedUtc": "2026-02-06T15:00:00Z",
    "requirements": "Find libraries for contract validation in Python."
  },
  "source": {
    "component": "research-client",
    "instanceId": "dev-01"
  }
}
