{
  "schemaName": "EventEnvelope",
  "schemaVersion": "1.0.0",
  "kind": "memory",
  "topic": "memory.query.result.v1",
  "message_id": "msg-mem-query-result-001",
  "emitted_utc": "2026-02-06T12:31:01Z",
  "trace_id": "trace-mem-002",
  "payload": {
    "schemaName": "MemoryQueryResult",
    "schemaVersion": "1.0.0",
    "generatedUtc": "2026-02-06T12:31:01Z",
    "scope": "task:AAS-123",
    "namespace": "decisions",
    "items": [],
    "nextCursor": null
  },
  "source": {
    "component": "memory-provider",
    "instanceId": "dev-01"
  }
}
