{
  "schemaName": "EventEnvelope",
  "schemaVersion": "1.0.0",
  "kind": "memory",
  "topic": "memory.query.v1",
  "message_id": "msg-mem-query-001",
  "emitted_utc": "2026-02-06T12:31:00Z",
  "trace_id": "trace-mem-002",
  "payload": {
    "schemaName": "MemoryQuery",
    "schemaVersion": "1.0.0",
    "issuedUtc": "2026-02-06T12:31:00Z",
    "scope": "task:AAS-123",
    "namespace": "decisions",
    "keyPrefix": "decision/",
    "limit": 50
  },
  "source": {
    "component": "memory-client",
    "instanceId": "dev-01"
  }
}
